url,date,time,author_name,author_link,quoted_user,posting,posting_wo_quote
/t2433574,2020-11-07,15:22,twigdoll,/u817343,Fri,Citat Ursprungligen postat av SittFintMen nu var ju den stora knäckfrågan om huruvida det finns någon högre intelligens som styr allting Evolutionsteorin har små brister Den har förfinats jättemycket under årens lopp när vi skaffat ny kunskap Samma sak gäller all annan vetenskap Men att det inte finns observerade mellanting till exakt allting botbevisar inte evolutionsteorin och den förutsäger heller inte att det ska finnas Jag förstår det också med att be dig kolla flera videos och läsa flera artiklar och jag har försökt undvika det och först och främst få fram själva poängen för jag vill inte sitta och bevisa saker som leder till att behöva bevisa nästa grej likt väl Gällande Evolutionsteorin jag vet inte riktigt hur definitionen är just för den Jag hävdar nämligen inte att det inte pågått någon förändring dock så står jag för att det är uppbyggt med intelligens och inte av en slump För att kunna bevisa att det då är intelligens så måste jag ändå bevisa att det inte är en slump annars vet jag inte riktigt hur detta ska gå till så knäckfrågan blir såhär om du inte har något bättre förslag Hur som helst det finns ganska mycket bevis för att det inte direkt är slumpvisa mutationer det är mycket mer sofistikerat än så Hastigheten för mutationer är t ex reglerade för anpassning om det skulle vara en slump så skulle det inte vara målinriktat dessutom är mutationer till största grad skapt för att vara gynnsamma men som inte är baserat på överlevnad och fortplantning det är styrt eller kontrollerat om man säger så Givetvis spelar överlevnad och fortplantning en roll det är den slumpvisa delen som dock inte stämmer riktigt Resultatet av varje enskilt tärningskast är fortfarande slumpmässigt om du inte vet exakt hur du ska kasta Här håller jag inte med riktigt om du menar att själva kastet är en slump du kan veta exakt hur du ska kasta men det kan ändå finnas faktorer som gör att det blir störningar Låt säga att tusen personer vet hur man kastar tärning men om de av någon anledning måste göra detta på samma plats som varandra så blir det kaos med att tärningar träffar varandra för att de inte är synkade eller hur man ska förklara omständigheterna så de kan fortfarande de bli fel fast man vet exakt vad rätt teknik är Så ja resultatet om vilka som vinner tärnings matchen kan man kalla för en slump Men det är lite som spermier resultatet av vilken spermie det blir för att skapa liv sker väl troligtvis av en slump dock är det inte så att en spermie simmar som den gör av en ren slump Dock om jag fattat detta rätt så är detta inte alls vad Dawkins säger när han påstår att mutationer är baserade på slumpmässighet och att det inte har ett syfte med att fåglar har vingar osv Utan det istället har blivit så för att fåglar har överlevt av en slump genom att ha vingar och sen fortsatt ha vingar som bara ser ut som att det finns ett syfte Så du förstår mig rätt det finns ingen sådan teknik enligt honom hur man kastar tärning Jag säger dock att resultatet ändå kan bli påverkat av slumpmässighet även om mutationen i sig bygger på andra faktorer Jag vet inte om det blir så värst begripligt men nu när vi ändå jämför mutationer med tärningar så kanske jag kan svara på din fråga Du påstod att om min tro på evolutionen vore sann så skulle vi se mer så skulle vi se friare utveckling än idag Vad grundar du det på Det behövs fler kast med en tärningen för att få fram det resultatet man vill få jämfört med om man skulle ha en teknik som gav fram ungefärliga resultat Så för att då nå det man då vill så sker detta i en högre hastighet med tärningskastaren som saknar teknik Dock denna metod som har teknik stannar och slutar kasta när det inte behövs mer och fortsätter när det behövs Medans den som saknar teknik fortsätter kasta och kasta för det finns inget som reglerar detta På ungefär på samma sätt skulle mutationer gå till för om det är slumpmässigt så är det också hänsynslöst Jag måste påpeka det även om jag sagt det tidigare att livet är mer komplicerat än hur ett liv överlever utan det är uppbyggt på ett sådant sätt att allt liv ska existera Om man struntar i det och bara går efter sitt egna genetiska led så finner man där också ett stort problem gällande balansen med miljön Det är alltså en nackdel på lång sikt med slumpmässig utveckling man behöver utvecklas med sin omgivning Här står det lite om att det tyder på att det är mindre tecken på slump och att det verkar tyda på att mutationer är till viss del kontrollerade för att vara gynnsamma osv https www discovermagazine com hea scientists sayHär står det om hastigheten på mutationer inte är direkt slumpvis utan strävar efter att vara optimalt för att minska risken för skadliga mutationer Även att det tyder att ännu flera mekanismer måste vara inblandade https www nature com articles nature10995,Jag förstår det också med att be dig kolla flera videos och läsa flera artiklar och jag har försökt undvika det och först och främst få fram själva poängen för jag vill inte sitta och bevisa saker som leder till att behöva bevisa nästa grej likt väl Gällande Evolutionsteorin jag vet inte riktigt hur definitionen är just för den Jag hävdar nämligen inte att det inte pågått någon förändring dock så står jag för att det är uppbyggt med intelligens och inte av en slump För att kunna bevisa att det då är intelligens så måste jag ändå bevisa att det inte är en slump annars vet jag inte riktigt hur detta ska gå till så knäckfrågan blir såhär om du inte har något bättre förslag Hur som helst det finns ganska mycket bevis för att det inte direkt är slumpvisa mutationer det är mycket mer sofistikerat än så Hastigheten för mutationer är t ex reglerade för anpassning om det skulle vara en slump så skulle det inte vara målinriktat dessutom är mutationer till största grad skapt för att vara gynnsamma men som inte är baserat på överlevnad och fortplantning det är styrt eller kontrollerat om man säger så Givetvis spelar överlevnad och fortplantning en roll det är den slumpvisa delen som dock inte stämmer riktigt Resultatet av varje enskilt tärningskast är fortfarande slumpmässigt om du inte vet exakt hur du ska kasta Här håller jag inte med riktigt om du menar att själva kastet är en slump du kan veta exakt hur du ska kasta men det kan ändå finnas faktorer som gör att det blir störningar Låt säga att tusen personer vet hur man kastar tärning men om de av någon anledning måste göra detta på samma plats som varandra så blir det kaos med att tärningar träffar varandra för att de inte är synkade eller hur man ska förklara omständigheterna så de kan fortfarande de bli fel fast man vet exakt vad rätt teknik är Så ja resultatet om vilka som vinner tärnings matchen kan man kalla för en slump Men det är lite som spermier resultatet av vilken spermie det blir för att skapa liv sker väl troligtvis av en slump dock är det inte så att en spermie simmar som den gör av en ren slump Dock om jag fattat detta rätt så är detta inte alls vad Dawkins säger när han påstår att mutationer är baserade på slumpmässighet och att det inte har ett syfte med att fåglar har vingar osv Utan det istället har blivit så för att fåglar har överlevt av en slump genom att ha vingar och sen fortsatt ha vingar som bara ser ut som att det finns ett syfte Så du förstår mig rätt det finns ingen sådan teknik enligt honom hur man kastar tärning Jag säger dock att resultatet ändå kan bli påverkat av slumpmässighet även om mutationen i sig bygger på andra faktorer Jag vet inte om det blir så värst begripligt men nu när vi ändå jämför mutationer med tärningar så kanske jag kan svara på din fråga Du påstod att om min tro på evolutionen vore sann så skulle vi se mer så skulle vi se friare utveckling än idag Vad grundar du det på Det behövs fler kast med en tärningen för att få fram det resultatet man vill få jämfört med om man skulle ha en teknik som gav fram ungefärliga resultat Så för att då nå det man då vill så sker detta i en högre hastighet med tärningskastaren som saknar teknik Dock denna metod som har teknik stannar och slutar kasta när det inte behövs mer och fortsätter när det behövs Medans den som saknar teknik fortsätter kasta och kasta för det finns inget som reglerar detta På ungefär på samma sätt skulle mutationer gå till för om det är slumpmässigt så är det också hänsynslöst Jag måste påpeka det även om jag sagt det tidigare att livet är mer komplicerat än hur ett liv överlever utan det är uppbyggt på ett sådant sätt att allt liv ska existera Om man struntar i det och bara går efter sitt egna genetiska led så finner man där också ett stort problem gällande balansen med miljön Det är alltså en nackdel på lång sikt med slumpmässig utveckling man behöver utvecklas med sin omgivning Här står det lite om att det tyder på att det är mindre tecken på slump och att det verkar tyda på att mutationer är till viss del kontrollerade för att vara gynnsamma osv https www discovermagazine com hea scientists sayHär står det om hastigheten på mutationer inte är direkt slumpvis utan strävar efter att vara optimalt för att minska risken för skadliga mutationer Även att det tyder att ännu flera mekanismer måste vara inblandade https www nature com articles nature10995
/t2433574,2020-11-07,15:54,SittFint,/u1321959,twigdoll,Citat Ursprungligen postat av twigdollJag förstår det också med att be dig kolla flera videos och läsa flera artiklar och jag har försökt undvika det och först och främst få fram själva poängen för jag vill inte sitta och bevisa saker som leder till att behöva bevisa nästa grej likt väl Trist men det är lite så det fungerar Citat Gällande Evolutionsteorin jag vet inte riktigt hur definitionen är just för den Jag hävdar nämligen inte att det inte pågått någon förändring dock så står jag för att det är uppbyggt med intelligens och inte av en slump Evolutionsteorin säger inte att det inte finns någon högre makt Däremot behöver den ingen högre makt för att förklara det den beskriver Citat För att kunna bevisa att det då är intelligens så måste jag ändå bevisa att det inte är en slump annars vet jag inte riktigt hur detta ska gå till så knäckfrågan blir såhär om du inte har något bättre förslag Inte för att vara den som är den men det är inte min sak att komma på hur du ska bevisa det hela Men om du vill börja i en annan ände kan du ju bevisa att det överhuvudtaget finns en högre makt Citat Hur som helst det finns ganska mycket bevis för att det inte direkt är slumpvisa mutationer det är mycket mer sofistikerat än så Hastigheten för mutationer är t ex reglerade för anpassning om det skulle vara en slump så skulle det inte vara målinriktat dessutom är mutationer till största grad skapt för att vara gynnsamma men som inte är baserat på överlevnad och fortplantning det är styrt eller kontrollerat om man säger så Givetvis spelar överlevnad och fortplantning en roll det är den slumpvisa delen som dock inte stämmer riktigt Det är inte målinriktat Och de flesta mutationer är inte gynnsamma Att saker har Citat Resultatet av varje enskilt tärningskast är fortfarande slumpmässigt om du inte vet exakt hur du ska kasta Här håller jag inte med riktigt om du menar att själva kastet är en slump du kan veta exakt hur du ska kasta men det kan ändå finnas faktorer som gör att det blir störningar Låt säga att tusen personer vet hur man kastar tärning men om de av någon anledning måste göra detta på samma plats som varandra så blir det kaos med att tärningar träffar varandra för att de inte är synkade eller hur man ska förklara omständigheterna så de kan fortfarande de bli fel fast man vet exakt vad rätt teknik är Så ja resultatet om vilka som vinner tärnings matchen kan man kalla för en slump Men det är lite som spermier resultatet av vilken spermie det blir för att skapa liv sker väl troligtvis av en slump dock är det inte så att en spermie simmar som den gör av en ren slump Sannolikhetslära är ganska komplicerat om man ska grotta ner sig i det Men det är rätt irrelevant för frågan om huruvida det hela styrs av en högre makt eller ej Citat Dock om jag fattat detta rätt så är detta inte alls vad Dawkins säger när han påstår att mutationer är baserade på slumpmässighet och att det inte har ett syfte med att fåglar har vingar osv Utan det istället har blivit så för att fåglar har överlevt av en slump genom att ha vingar och sen fortsatt ha vingar som bara ser ut som att det finns ett syfte Så du förstår mig rätt det finns ingen sådan teknik enligt honom hur man kastar tärning Jag säger dock att resultatet ändå kan bli påverkat av slumpmässighet även om mutationen i sig bygger på andra faktorer Fast du har ännu inte sagt något som styrker det Citat Jag vet inte om det blir så värst begripligt men nu när vi ändå jämför mutationer med tärningar så kanske jag kan svara på din fråga Du påstod att om min tro på evolutionen vore sann så skulle vi se mer så skulle vi se friare utveckling än idag Vad grundar du det på Det behövs fler kast med en tärningen för att få fram det resultatet man vill få jämfört med om man skulle ha en teknik som gav fram ungefärliga resultat Så för att då nå det man då vill så sker detta i en högre hastighet med tärningskastaren som saknar teknik Dock denna metod som har teknik stannar och slutar kasta när det inte behövs mer och fortsätter när det behövs Medans den som saknar teknik fortsätter kasta och kasta för det finns inget som reglerar detta På ungefär på samma sätt skulle mutationer gå till för om det är slumpmässigt så är det också hänsynslöst Jag måste påpeka det även om jag sagt det tidigare att livet är mer komplicerat än hur ett liv överlever utan det är uppbyggt på ett sådant sätt att allt liv ska existera Om man struntar i det och bara går efter sitt egna genetiska led så finner man där också ett stort problem gällande balansen med miljön Det är alltså en nackdel på lång sikt med slumpmässig utveckling man behöver utvecklas med sin omgivning Självfallet kan man nå resultat mycket snabbare om det hela är målinriktat Det är avel och genmodifiering ett bra exempel på Men du har fortfarande inte svarat på frågan Frågan handlar om vad du har för grund för att påstå att slumpen inte skulle vara tillräcklig för den frihetsgrad av utvecklingen som vi ser idag Citat Här står det lite om att det tyder på att det är mindre tecken på slump och att det verkar tyda på att mutationer är till viss del kontrollerade för att vara gynnsamma osv https www discovermagazine com hea scientists sayHär står det om hastigheten på mutationer inte är direkt slumpvis utan strävar efter att vara optimalt för att minska risken för skadliga mutationer Även att det tyder att ännu flera mekanismer måste vara inblandade https www nature com articles nature10995Alltså sådant är ett resultat av slumpmässiga mutationer det också Att sådana skydd finns är välkänt sedan länge Men du påstår att det finns någon högre makt och något syfte bakom allt och det är något helt annat,Trist men det är lite så det fungerar Evolutionsteorin säger inte att det inte finns någon högre makt Däremot behöver den ingen högre makt för att förklara det den beskriver Inte för att vara den som är den men det är inte min sak att komma på hur du ska bevisa det hela Men om du vill börja i en annan ände kan du ju bevisa att det överhuvudtaget finns en högre makt Det är inte målinriktat Och de flesta mutationer är inte gynnsamma Att saker har Sannolikhetslära är ganska komplicerat om man ska grotta ner sig i det Men det är rätt irrelevant för frågan om huruvida det hela styrs av en högre makt eller ej Fast du har ännu inte sagt något som styrker det g vet inte om det blir så värst begripligt men nu när vi ändå jämför mutationer med tärningar så kanske jag kan svara på din fråga Du påstod att om min tro på evolutionen vore sann så skulle vi se mer så skulle vi se friare utveckling än idag Vad grundar du det på Det behövs fler kast med en tärningen för att få fram det resultatet man vill få jämfört med om man skulle ha en teknik som gav fram ungefärliga resultat Så för att då nå det man då vill så sker detta i en högre hastighet med tärningskastaren som saknar teknik Dock denna metod som har teknik stannar och slutar kasta när det inte behövs mer och fortsätter när det behövs Medans den som saknar teknik fortsätter kasta och kasta för det finns inget som reglerar detta På ungefär på samma sätt skulle mutationer gå till för om det är slumpmässigt så är det också hänsynslöst Jag måste påpeka det även om jag sagt det tidigare att livet är mer komplicerat än hur ett liv överlever utan det är uppbyggt på ett sådant sätt att allt liv ska existera Om man struntar i det och bara går efter sitt egna genetiska led så finner man där också ett stort problem gällande balansen med miljön Det är alltså en nackdel på lång sikt med slumpmässig utveckling man behöver utvecklas med sin omgivning Självfallet kan man nå resultat mycket snabbare om det hela är målinriktat Det är avel och genmodifiering ett bra exempel på Men du har fortfarande inte svarat på frågan Frågan handlar om vad du har för grund för att påstå att slumpen inte skulle vara tillräcklig för den frihetsgrad av utvecklingen som vi ser idag Alltså sådant är ett resultat av slumpmässiga mutationer det också Att sådana skydd finns är välkänt sedan länge Men du påstår att det finns någon högre makt och något syfte bakom allt och det är något helt annat
/t2433574,2020-11-07,16:51,twigdoll,/u817343,Fri,Citat Ursprungligen postat av SittFintTrist men det är lite så det fungerar Evolutionsteorin säger inte att det inte finns någon högre makt Däremot behöver den ingen högre makt för att förklara det den beskriver Inte för att vara den som är den men det är inte min sak att komma på hur du ska bevisa det hela Men om du vill börja i en annan ände kan du ju bevisa att det överhuvudtaget finns en högre makt Det är inte målinriktat Och de flesta mutationer är inte gynnsamma Att saker har Sannolikhetslära är ganska komplicerat om man ska grotta ner sig i det Men det är rätt irrelevant för frågan om huruvida det hela styrs av en högre makt eller ej Fast du har ännu inte sagt något som styrker det Självfallet kan man nå resultat mycket snabbare om det hela är målinriktat Det är avel och genmodifiering ett bra exempel på Men du har fortfarande inte svarat på frågan Frågan handlar om vad du har för grund för att påstå att slumpen inte skulle vara tillräcklig för den frihetsgrad av utvecklingen som vi ser idag Alltså sådant är ett resultat av slumpmässiga mutationer det också Att sådana skydd finns är välkänt sedan länge Men du påstår att det finns någon högre makt och något syfte bakom allt och det är något helt annat Jag tror inte detta kommer gå så bra om du inte argumenterar på ett sätt som bemöter vad jag själv står för T ex när du säger att en mutation inte är gynnsam så har jag ändå tagit upp kollektivet jordelivet går i första hand och jag antar att du inte ser det ifrån den vinkeln överhuvudtaget Jag påpekade detta i förgående inlägg som en påminnelse Dessutom har jag sagt att det finns ett intelligent system där jag skrev kalla det för gud om du vill men du hävdar att ett sådant system inte existerar Jag tog inte upp högre makt på ett sådant sätt du lägger upp det nu vad som finns är systemet och dess intelligens för att fungera Du hävdade att detta inte var sant och ett sådant system inte existerar alls och att det saknas bevis vilket vi då gick till denna tråden för Sen kan du ställa frågan vad har skapat systemet och där kommer kanske den typiska guden in på något magiskt vis och man får förlita sig på tro jag har inga bevis där nej Evolutionsteorin förklarar inte uppkomsten av liv den förklarar evolutionen enbart Den förklarar alltså evolutionen med slumpen inget mer Du får påpeka vart jag påstår något som helst annat men då ska det gälla denna tråden eller den förra Min personliga tro blandar jag inte in i detta för de handlar inte om den,Jag tror inte detta kommer gå så bra om du inte argumenterar på ett sätt som bemöter vad jag själv står för T ex när du säger att en mutation inte är gynnsam så har jag ändå tagit upp kollektivet jordelivet går i första hand och jag antar att du inte ser det ifrån den vinkeln överhuvudtaget Jag påpekade detta i förgående inlägg som en påminnelse Dessutom har jag sagt att det finns ett intelligent system där jag skrev kalla det för gud om du vill men du hävdar att ett sådant system inte existerar Jag tog inte upp högre makt på ett sådant sätt du lägger upp det nu vad som finns är systemet och dess intelligens för att fungera Du hävdade att detta inte var sant och ett sådant system inte existerar alls och att det saknas bevis vilket vi då gick till denna tråden för Sen kan du ställa frågan vad har skapat systemet och där kommer kanske den typiska guden in på något magiskt vis och man får förlita sig på tro jag har inga bevis där nej Evolutionsteorin förklarar inte uppkomsten av liv den förklarar evolutionen enbart Den förklarar alltså evolutionen med slumpen inget mer Du får påpeka vart jag påstår något som helst annat men då ska det gälla denna tråden eller den förra Min personliga tro blandar jag inte in i detta för de handlar inte om den
/t2433574,2020-11-07,17:06,SittFint,/u1321959,twigdoll,Citat Ursprungligen postat av twigdollJag tror inte detta kommer gå så bra om du inte argumenterar på ett sätt som bemöter vad jag själv står för T ex när du säger att en mutation inte är gynnsam så har jag ändå tagit upp kollektivet jordelivet går i första hand och jag antar att du inte ser det ifrån den vinkeln överhuvudtaget Jag påpekade detta i förgående inlägg som en påminnelse För att vara helt ärlig så låter det här som att du säger att det inte kommer gå så bra om jag fortsätter säga saker du inte kan svara på Och så har jag ändå tagit upp kollektivet jordelivet går i första hand är ytterligare ett påstående utan belägg Citat Dessutom har jag sagt att det finns ett intelligent system där jag skrev kalla det för gud om du vill men du hävdar att ett sådant system inte existerar Jag tog inte upp högre makt på ett sådant sätt du lägger upp det nu vad som finns är systemet och dess intelligens för att fungera Du hävdade att detta inte var sant och ett sådant system inte existerar alls och att det saknas bevis vilket vi då gick till denna tråden för Högre makt gud inneboende intelligens i hela skapelsen kalla det för vad du vill För att vara mer precis påstår jag inte att det inte existerar Jag påstår bara att det inte finns något som tyder på det Och saker det inte finns bevis för finns ingen anledning att tro på Precis som enhörningar och jultomten Men Citat Sen kan du ställa frågan vad har skapat systemet och där kommer kanske den typiska guden in på något magiskt vis och man får förlita sig på tro jag har inga bevis där nej Då är vi överens där Citat Evolutionsteorin förklarar inte uppkomsten av liv den förklarar evolutionen enbart Den förklarar alltså evolutionen med slumpen inget mer Den förutsätter inte att alla mutationer är helt slumpmässiga Däremot är de flesta mutationer helt slumpmässiga även om det finns undantag Genmodifiering är en sådan Virus är något mellanting beroende på hur man ser det Avel är slumpmässiga mutationer men där man styr urvalet medvetet Men du har helt rätt i att evolutionsteorin inte förklarar uppkomsten av liv varför det nu skulle vara relevant,För att vara helt ärlig så låter det här som att du säger att det inte kommer gå så bra om jag fortsätter säga saker du inte kan svara på Och så har jag ändå tagit upp kollektivet jordelivet går i första hand är ytterligare ett påstående utan belägg Högre makt gud inneboende intelligens i hela skapelsen kalla det för vad du vill För att vara mer precis påstår jag inte att det inte existerar Jag påstår bara att det inte finns något som tyder på det Och saker det inte finns bevis för finns ingen anledning att tro på Precis som enhörningar och jultomten Men Då är vi överens där Den förutsätter inte att alla mutationer är helt slumpmässiga Däremot är de flesta mutationer helt slumpmässiga även om det finns undantag Genmodifiering är en sådan Virus är något mellanting beroende på hur man ser det Avel är slumpmässiga mutationer men där man styr urvalet medvetet Men du har helt rätt i att evolutionsteorin inte förklarar uppkomsten av liv varför det nu skulle vara relevant
