url,date,time,author_name,author_link,quoted_user,posting,posting_wo_quote
/t2433574,2020-11-07,17:40,twigdoll,/u817343,NA,Citat Ursprungligen postat av SittFintFör att vara helt ärlig så låter det här som att du säger att det inte kommer gå så bra om jag fortsätter säga saker du inte kan svara på Och så har jag ändå tagit upp kollektivet jordelivet går i första hand är ytterligare ett påstående utan belägg Högre makt gud inneboende intelligens i hela skapelsen kalla det för vad du vill För att vara mer precis påstår jag inte att det inte existerar Jag påstår bara att det inte finns något som tyder på det Och saker det inte finns bevis för finns ingen anledning att tro på Precis som enhörningar och jultomten Men Då är vi överens där Den förutsätter inte att alla mutationer är helt slumpmässiga Däremot är de flesta mutationer helt slumpmässiga även om det finns undantag Genmodifiering är en sådan Virus är något mellanting beroende på hur man ser det Avel är slumpmässiga mutationer men där man styr urvalet medvetet Men du har helt rätt i att evolutionsteorin inte förklarar uppkomsten av liv varför det nu skulle vara relevant Och för att vara uppriktig mot dig så är det ungefär som jag får bevisa saker för dig som du sen säger att allt inte alls en totalt slumpmässigt som du påstod först och att du visste om hela tiden att det fanns inbyggda skydd osv Och att du hela tiden tummar på vad som faktiskt är en slump Är vi inte ens överens om vad en slump faktiskt är så är det ganska kört där jag kan fortsätta men håll dig till vad jag står för då Här började det Citat Okej låt mig säga så här jag tror på en högre intelligens kalla det gud om du vill som driver djuren och naturen genom uppdelade uppgifter mellan dom Ett bi gör ett jobb den följer bara sina instinkter med det är ändå ett arbete i ett större nätverk man kan inte ge beröm för att biet briljerar med sin intelligens men på systemet i det stora när man länkar alla djur och växter det är först då man ser storheten Citat Då är vi helt olika Jag tror inte ett dyft på det Finns inget som tyder på det Du menar alltså att ett bi av en slump får nektar som gynnar biet och pollen som i sin tur gynnar blomman Eller kommer det ytterligare undantag nu i utvecklingen När jag försökte förklara detta så var det flummigt alltså något du inte förstår Hur förväntar du dig att jag ska svara Du börjar dra in Jultomten och trams i detta Hur kan du på riktigt säga att det är samma sak som enhörningar och sånt Systemet finns där och går att studera till skillnad ifrån en enhörning som inte finns Skillnaden är att du hävdar att det kan se ut som ett system men inte är det och att det inte finns bevis men det gör det,Och för att vara uppriktig mot dig så är det ungefär som jag får bevisa saker för dig som du sen säger att allt inte alls en totalt slumpmässigt som du påstod först och att du visste om hela tiden att det fanns inbyggda skydd osv Och att du hela tiden tummar på vad som faktiskt är en slump Är vi inte ens överens om vad en slump faktiskt är så är det ganska kört där jag kan fortsätta men håll dig till vad jag står för då Här började det Du menar alltså att ett bi av en slump får nektar som gynnar biet och pollen som i sin tur gynnar blomman Eller kommer det ytterligare undantag nu i utvecklingen När jag försökte förklara detta så var det flummigt alltså något du inte förstår Hur förväntar du dig att jag ska svara Du börjar dra in Jultomten och trams i detta Hur kan du på riktigt säga att det är samma sak som enhörningar och sånt Systemet finns där och går att studera till skillnad ifrån en enhörning som inte finns Skillnaden är att du hävdar att det kan se ut som ett system men inte är det och att det inte finns bevis men det gör det
/t2433574,2020-11-07,18:01,SittFint,/u1321959,twigdoll,Citat Ursprungligen postat av twigdollOch för att vara uppriktig mot dig så är det ungefär som jag får bevisa saker för dig som du sen säger att allt inte alls en totalt slumpmässigt som du påstod först och att du visste om hela tiden att det fanns inbyggda skydd osv Och att du hela tiden tummar på vad som faktiskt är en slump Är vi inte ens överens om vad en slump faktiskt är så är det ganska kört där jag kan fortsätta men håll dig till vad jag står för då Här började det Hela alltet grundade sig i diskussionen slump inneboende intelligens Jag tror inte på att livet är något speciellt alls Det är bara väldigt komplicerade kemiska reaktioner Den fria viljan är en illusion För tillfället tror jag inte på ett deterministiskt universum för det verkar som att kvantmekaniken sätter lite käppar i hjulet för det Men om det inte hade varit för att Heisenbergs osäkerhetsrelation och liknande saker krånglar till det så hade jag trott på ett helt 100 deterministiskt universum Citat Du menar alltså att ett bi av en slump får nektar som gynnar biet och pollen som i sin tur gynnar blomman Eller kommer det ytterligare undantag nu i utvecklingen Jag hävdar att det inte finns någon målinriktad design som gjort att biet och blomman ser ut som de gör och att de fungerar bra tillsammans Om det är slump eller ej känns mer som en filosofisk fråga än en vetenskaplig Jag skulle kunna argumentera för att det är slumpen som gör att jag skriver det här inlägget Citat När jag försökte förklara detta så var det flummigt alltså något du inte förstår Hur förväntar du dig att jag ska svara Du börjar dra in Jultomten och trams i detta Hur kan du på riktigt säga att det är samma sak som enhörningar och sånt Systemet finns där och går att studera till skillnad ifrån en enhörning som inte finns Skillnaden är att du hävdar att det kan se ut som ett system men inte är det och att det inte finns bevis men det gör det Jag drar in jultomten och enhörningar av den enkla anledningen att jag inte tror på dem av EXAKT samma anledning som jag inte tror på någon inneboende intelligens hos livet Bevis saknas Du säger att det finns bevis så fram med dem då Som du sagt tidigare så kan vad som är slump bero på direkt okunskap Det beror också på i vilken kontext man pratar om det hela Men bara för att få lite rull jag köper att saker inte är helt slumpmässiga enligt någon definition på slump så nu undrar jag hur det bevisar en inneboende intelligens,Hela alltet grundade sig i diskussionen slump inneboende intelligens Jag tror inte på att livet är något speciellt alls Det är bara väldigt komplicerade kemiska reaktioner Den fria viljan är en illusion För tillfället tror jag inte på ett deterministiskt universum för det verkar som att kvantmekaniken sätter lite käppar i hjulet för det Men om det inte hade varit för att Heisenbergs osäkerhetsrelation och liknande saker krånglar till det så hade jag trott på ett helt 100 deterministiskt universum Jag hävdar att det inte finns någon målinriktad design som gjort att biet och blomman ser ut som de gör och att de fungerar bra tillsammans Om det är slump eller ej känns mer som en filosofisk fråga än en vetenskaplig Jag skulle kunna argumentera för att det är slumpen som gör att jag skriver det här inlägget Jag drar in jultomten och enhörningar av den enkla anledningen att jag inte tror på dem av EXAKT samma anledning som jag inte tror på någon inneboende intelligens hos livet Bevis saknas Du säger att det finns bevis så fram med dem då Som du sagt tidigare så kan vad som är slump bero på direkt okunskap Det beror också på i vilken kontext man pratar om det hela Men bara för att få lite rull jag köper att saker inte är helt slumpmässiga enligt någon definition på slump så nu undrar jag hur det bevisar en inneboende intelligens
/t2433574,2020-11-07,19:50,twigdoll,/u817343,NA,Citat Ursprungligen postat av SittFintSom du sagt tidigare så kan vad som är slump bero på direkt okunskap Det beror också på i vilken kontext man pratar om det hela Men bara för att få lite rull jag köper att saker inte är helt slumpmässiga enligt någon definition på slump så nu undrar jag hur det bevisar en inneboende intelligens Vad bra Ska försöka göra detta enkelt Intelligens är att förstå begripa inse avgöra och kunna fatta beslut m m till en början så trodde man detta bara kretsar kring människan Men nu vet man att till och med träd har intelligens de kan utföra ganska komplicerade beslut det kan t ex genom sina löv beräkna solstrålningen och mycket annat Det finns till och med ett träd som kan gå förflytta sig Socratea exorrhiza Så varför jag tog upp detta är för att förklara att intelligens till att börja med kan se utan på ett helt annat sätt än hur en människa är konstruerad Träden har inte hjärnor som vi har dock har det tankar som är uppbyggda på liknande sätt Nu då till det krångliga är att det kan fattas beslut i naturen alltså strategiska drag som görs av flera arter samtidigt som en grupp för att utföra ett samarbete Det sker inte på en dag direkt det sker gradvis men under utveckling med riktning Om jag ska ge något exempel på detta så är näringskedjan rätt så bra men också hur växter och svampar fungerar i skogen m mNär man rubbar denna natur genom att odla så rubbar man en balans skapad av en intelligens Och åter igen det är ett intelligent system jag pratar om precis som en dator anses ha intelligens även om den är konstgjord och saknar en själ Och även om man anser att naturen och alla arter är baserade på en slump så är det fortfarande ett system som jobbar genom olika arter av svampar växter och djur En sån sak som att rovdjur är färre i antal och deras bytesdjur består av ett högre antal matchar en högre funktion för att de inte ska spåra ur för att växtätarna behövs men måste regleras Så min poäng är att det fungerar och är intelligent och de kan man egentligen avgöra på resultat,Vad bra Ska försöka göra detta enkelt Intelligens är att förstå begripa inse avgöra och kunna fatta beslut m m till en början så trodde man detta bara kretsar kring människan Men nu vet man att till och med träd har intelligens de kan utföra ganska komplicerade beslut det kan t ex genom sina löv beräkna solstrålningen och mycket annat Det finns till och med ett träd som kan gå förflytta sig Socratea exorrhiza Så varför jag tog upp detta är för att förklara att intelligens till att börja med kan se utan på ett helt annat sätt än hur en människa är konstruerad Träden har inte hjärnor som vi har dock har det tankar som är uppbyggda på liknande sätt Nu då till det krångliga är att det kan fattas beslut i naturen alltså strategiska drag som görs av flera arter samtidigt som en grupp för att utföra ett samarbete Det sker inte på en dag direkt det sker gradvis men under utveckling med riktning Om jag ska ge något exempel på detta så är näringskedjan rätt så bra men också hur växter och svampar fungerar i skogen m mNär man rubbar denna natur genom att odla så rubbar man en balans skapad av en intelligens Och åter igen det är ett intelligent system jag pratar om precis som en dator anses ha intelligens även om den är konstgjord och saknar en själ Och även om man anser att naturen och alla arter är baserade på en slump så är det fortfarande ett system som jobbar genom olika arter av svampar växter och djur En sån sak som att rovdjur är färre i antal och deras bytesdjur består av ett högre antal matchar en högre funktion för att de inte ska spåra ur för att växtätarna behövs men måste regleras Så min poäng är att det fungerar och är intelligent och de kan man egentligen avgöra på resultat
/t2433574,2020-11-07,20:39,SittFint,/u1321959,twigdoll,Citat Ursprungligen postat av twigdollVad bra Ska försöka göra detta enkelt Intelligens är att förstå begripa inse avgöra och kunna fatta beslut m m till en början så trodde man detta bara kretsar kring människan Men nu vet man att till och med träd har intelligens de kan utföra ganska komplicerade beslut det kan t ex genom sina löv beräkna solstrålningen och mycket annat Det finns till och med ett träd som kan gå förflytta sig Socratea exorrhiza Så varför jag tog upp detta är för att förklara att intelligens till att börja med kan se utan på ett helt annat sätt än hur en människa är konstruerad Träden har inte hjärnor som vi har dock har det tankar som är uppbyggda på liknande sätt Tveksam definition på intelligens men visst Fast då kan man i princip säga att en dörrklocka har viss intelligens eftersom den fattar att den ska ringa när man trycker på en knapp Någonstans börjar det bli rätt irrelevant att prata om intelligens Citat Nu då till det krångliga är att det kan fattas beslut i naturen alltså strategiska drag som görs av flera arter samtidigt som en grupp för att utföra ett samarbete Det sker inte på en dag direkt det sker gradvis men under utveckling med riktning Om jag ska ge något exempel på detta så är näringskedjan rätt så bra men också hur växter och svampar fungerar i skogen m mNär man rubbar denna natur genom att odla så rubbar man en balans skapad av en intelligens Det hela beror ju på vad du menar med att balansen är skapad av intelligens Även om vi säger att växter är intelligenta något jag verkligen drar mig för men låt gå för diskussionen så handlar det fortfarande inte om någon övergripande intelligens för att förstå helheten När man simulerar sådana här saker slås man ofta av hur väldigt enkla formler som behövs för att åstadkomma något som ser komplicerat och nästan intelligent ut Ett exempel är fiskstim Nu var det rätt länge sedan jag gjorde det men det enda varje enskild fisk behöver göra är i princip bara att se till att hålla sig nära men inte för nära samt fortsätta simma Matematiken bakom är oerhört enkel Det behövs ingen övergripande intelligens som förstår helheten Jag har även programmerat en evolutionssimulator Då skapade jag djur som bestod av en liten bit data som motsvarar DNA Deras genom gav dem olika egenskaper Jag skapade också en enkel miljö för dem att leva i De behövde få i sig näring på något sätt Antingen fick de näringen genom växter eller så kunde de äta varandra Växterna ploppade bara upp här och var slumpmässigt och kunde inte själva mutera eller reproducera sig När individerna träffade på en annan individ kunde de antingen slåss eller fly Därefter körde jag en enkel loop där de dog eller överlevde i varje steg De kunde dö av att bli uppätna eller svält De som överlevde reproducerade sig genom kloning och klonen fick slumpmässiga mutationer Något som faktiskt hände flera gånger var att det bildades två arter som balanserade varandra Och visst jag kan ge dig att det krävdes intelligens för att skapa programmet Men jag styrde det inte på något speciellt sätt och alla mutationer var slumpmässiga Det enda jag styrde med miljön var att försöka göra den så realistisk som möjligt även om den var oerhört enkel Exempelvis fick man mycket mer energi av att äta någon annan än bara växter men det var också mer energikrävande att behöva jaga Citat Och åter igen det är ett intelligent system jag pratar om precis som en dator anses ha intelligens även om den är konstgjord och saknar en själ Och även om man anser att naturen och alla arter är baserade på en slump så är det fortfarande ett system som jobbar genom olika arter av svampar växter och djur En sån sak som att rovdjur är färre i antal och deras bytesdjur består av ett högre antal matchar en högre funktion för att de inte ska spåra ur för att växtätarna behövs men måste regleras Så min poäng är att det fungerar och är intelligent och de kan man egentligen avgöra på resultat Det behövs ingen högre funktion för att åstadkomma detta och växtätarna behöver inte regleras Hade inte rovdjuren funnits hade de ändå varit helt självreglerande eftersom rovdjur och växtätare har samma relation som växtätare och växter,Tveksam definition på intelligens men visst Fast då kan man i princip säga att en dörrklocka har viss intelligens eftersom den fattar att den ska ringa när man trycker på en knapp Någonstans börjar det bli rätt irrelevant att prata om intelligens Det hela beror ju på vad du menar med att balansen är skapad av intelligens Även om vi säger att växter är intelligenta något jag verkligen drar mig för men låt gå för diskussionen så handlar det fortfarande inte om någon övergripande intelligens för att förstå helheten När man simulerar sådana här saker slås man ofta av hur väldigt enkla formler som behövs för att åstadkomma något som ser komplicerat och nästan intelligent ut Ett exempel är fiskstim Nu var det rätt länge sedan jag gjorde det men det enda varje enskild fisk behöver göra är i princip bara att se till att hålla sig nära men inte för nära samt fortsätta simma Matematiken bakom är oerhört enkel Det behövs ingen övergripande intelligens som förstår helheten Jag har även programmerat en evolutionssimulator Då skapade jag djur som bestod av en liten bit data som motsvarar DNA Deras genom gav dem olika egenskaper Jag skapade också en enkel miljö för dem att leva i De behövde få i sig näring på något sätt Antingen fick de näringen genom växter eller så kunde de äta varandra Växterna ploppade bara upp här och var slumpmässigt och kunde inte själva mutera eller reproducera sig När individerna träffade på en annan individ kunde de antingen slåss eller fly Därefter körde jag en enkel loop där de dog eller överlevde i varje steg De kunde dö av att bli uppätna eller svält De som överlevde reproducerade sig genom kloning och klonen fick slumpmässiga mutationer Något som faktiskt hände flera gånger var att det bildades två arter som balanserade varandra Och visst jag kan ge dig att det krävdes intelligens för att skapa programmet Men jag styrde det inte på något speciellt sätt och alla mutationer var slumpmässiga Det enda jag styrde med miljön var att försöka göra den så realistisk som möjligt även om den var oerhört enkel Exempelvis fick man mycket mer energi av att äta någon annan än bara växter men det var också mer energikrävande att behöva jaga Det behövs ingen högre funktion för att åstadkomma detta och växtätarna behöver inte regleras Hade inte rovdjuren funnits hade de ändå varit helt självreglerande eftersom rovdjur och växtätare har samma relation som växtätare och växter
/t2433574,2020-11-08,09:12,twigdoll,/u817343,NA,Citat Ursprungligen postat av SittFintTveksam definition på intelligens men visst Fast då kan man i princip säga att en dörrklocka har viss intelligens eftersom den fattar att den ska ringa när man trycker på en knapp Någonstans börjar det bli rätt irrelevant att prata om intelligens Det behövs ingen högre funktion för att åstadkomma detta och växtätarna behöver inte regleras Hade inte rovdjuren funnits hade de ändå varit helt självreglerande eftersom rovdjur och växtätare har samma relation som växtätare och växter Jag fick klippa ner allting för att detta förstod du nog väldigt fel vad som är intelligens och dessutom förstår du nog inte hur ett kretslopp fungerar En dörrklocka fattar inte att den ska ringa skulle den däremot ha en speciell rington beroende på vilket humör personen som ringde var på eller att den hade olika ringtoner för olika personer och detta fyller någon funktion så existerar det en intelligens Intelligens är med största sannolik i detta fallet tagen ifrån en människa och dess tankar som denne har placerat i en maskin intelligensen är fortfarande synlig fast den är konstgjord Och med att tankarna är placerade i en maskin menar jag det bokstavligen det är inte en slump hur den arbetar när den gör olika val Ett bi kan göra abstrakta iakttagelser och göra bedömningar i ett experiment har man sett detta biet i samband med labyrinter med blå och gula linjer att efter de följt båda färger först sen hållit sig till den färg som mest varit gynnsam Intelligens jaSamma sak är det med träd för det är inte bara placera ett träd var som helst eller hur som helst vad ska avgöra hur trädet ska växa om inte trädet Det är inte så som en dörrklocka som är en påhittad sak av en människa funktionen där är att om någon är utanför dörren kan de välja att trycka på en klocka eller knacka på dörren och hoppas på att en person på andra sidan öppnar dörren Alltså är den ganska obetydlig och hade inte ens behövt existera ens Förnekar du att du har intelligens själv Om du har intelligens och evolutionen är baserat på en slump och intelligens inte kan fungera om det är baserat på en slump så kan du inte ha intelligens då du är en del av evolutionen Skulle du jämföra dig själv med en ringklocka Det behövs ingen högre funktion för att åstadkomma detta och växtätarna behöver inte regleras Hade inte rovdjuren funnits hade de ändå varit helt självreglerande eftersom rovdjur och växtätare har samma relation som växtätare och växter Naturens kretslopp är inte uppbyggt så som du beskriver Jag kan verkligen inte förstå hur du får ihop det Med ditt resonemang så behöver vi ingenting och kan ha en död planet,Jag fick klippa ner allting för att detta förstod du nog väldigt fel vad som är intelligens och dessutom förstår du nog inte hur ett kretslopp fungerar En dörrklocka fattar inte att den ska ringa skulle den däremot ha en speciell rington beroende på vilket humör personen som ringde var på eller att den hade olika ringtoner för olika personer och detta fyller någon funktion så existerar det en intelligens Intelligens är med största sannolik i detta fallet tagen ifrån en människa och dess tankar som denne har placerat i en maskin intelligensen är fortfarande synlig fast den är konstgjord Och med att tankarna är placerade i en maskin menar jag det bokstavligen det är inte en slump hur den arbetar när den gör olika val Ett bi kan göra abstrakta iakttagelser och göra bedömningar i ett experiment har man sett detta biet i samband med labyrinter med blå och gula linjer att efter de följt båda färger först sen hållit sig till den färg som mest varit gynnsam Intelligens jaSamma sak är det med träd för det är inte bara placera ett träd var som helst eller hur som helst vad ska avgöra hur trädet ska växa om inte trädet Det är inte så som en dörrklocka som är en påhittad sak av en människa funktionen där är att om någon är utanför dörren kan de välja att trycka på en klocka eller knacka på dörren och hoppas på att en person på andra sidan öppnar dörren Alltså är den ganska obetydlig och hade inte ens behövt existera ens Förnekar du att du har intelligens själv Om du har intelligens och evolutionen är baserat på en slump och intelligens inte kan fungera om det är baserat på en slump så kan du inte ha intelligens då du är en del av evolutionen Skulle du jämföra dig själv med en ringklocka Det behövs ingen högre funktion för att åstadkomma detta och växtätarna behöver inte regleras Hade inte rovdjuren funnits hade de ändå varit helt självreglerande eftersom rovdjur och växtätare har samma relation som växtätare och växter Naturens kretslopp är inte uppbyggt så som du beskriver Jag kan verkligen inte förstå hur du får ihop det Med ditt resonemang så behöver vi ingenting och kan ha en död planet
